<?xml version="1.0" encoding="UTF-8" standalone="no" ?>

<!DOCTYPE entites SYSTEM "dtd/maps.dtd">

<entites>
    <monstres/>
    <pnjs/>
    <meubles>
        <meuble x="384" y="64" type="7">
            <quete quete="0" histoire="2"/>
        </meuble>
        <meuble x="320" y="128" type="0">
            <quete quete="2" histoire="2"/>
        </meuble>
    </meubles>
    <places/>
</entites>