<?xml version="1.0" encoding="UTF-8" standalone="no" ?>

<!DOCTYPE entites SYSTEM "dtd/maps.dtd">

<entites>
    <monstres/>
    <pnjs>
        <pnj x="384" y="64" type="0">
            <quete quete="0" histoire="6"/>
            <quete quete="4" histoire="6"/>
            <quete quete="10" histoire="6"/>
        </pnj>
    </pnjs>
    <meubles/>
    <places/>
</entites>